Loan_Type,State,City,URL_Slug,Title,Meta_Description,H1,Word_Count,Status,CTR
Personal Loan,Maharashtra,Pune,personal-loan/maharashtra/pune,"Personal Loan in Pune – Instant Approval for IT & Salaried | Techstar","Need quick cash in Pune? Get Personal Loan approved in 24 hrs. Compare HDFC, ICICI & 50+ banks. Low interest, minimal docs, doorstep service in Hinjewadi, Kharadi & Baner.",Best Personal Loan in Pune,945,published,2.3
Personal Loan,Maharashtra,Mumbai,personal-loan/maharashtra/mumbai,"Personal Loan in Mumbai – Fast Funds for Finance Pros | Techstar","Mumbai residents get Personal Loan within 24 hrs. Self-employed & salaried both eligible. Compare SBI, Kotak, Standard Chartered & 50+ lenders. Apply in 5 mins.",Best Personal Loan in Mumbai,950,published,1.8
Personal Loan,Maharashtra,Nagpur,personal-loan/maharashtra/nagpur,"Personal Loan in Nagpur – Lowest Rate for Salaried Employees | Techstar","Apply for Personal Loan in Nagpur with rates from 10.50% p.a. Manufacturing & logistics professionals get priority. Compare 50+ banks. Approval in 24–48 hrs.",Best Personal Loan in Nagpur,940,published,1.2
Personal Loan,Maharashtra,Nashik,personal-loan/maharashtra/nashik,"Personal Loan in Nashik – Quick Funds for Agri & Wine Sector | Techstar","Get Personal Loan in Nashik without pledging assets. Agri-entrepreneurs & salaried both eligible. Low EMI, fast processing, minimal docs. Apply online today.",Best Personal Loan in Nashik,938,published,1.0
Personal Loan,Maharashtra,Thane,personal-loan/maharashtra/thane,"Personal Loan in Thane – Instant Cash for IT & Real Estate Pros | Techstar","Thane residents apply for Personal Loan and get approved within 24 hrs. Compare HDFC, IDFC & 50+ banks. Paperless process, lowest EMI. Doorstep service available.",Best Personal Loan in Thane,945,published,1.1
Personal Loan,Maharashtra,Aurangabad,personal-loan/maharashtra/aurangabad,"Personal Loan in Aurangabad – Fast Approval for Industrial Workers | Techstar","Industrial professionals in Aurangabad get Personal Loan at low rates. Compare Bank of Maharashtra, SBI & Kotak. Approved in 24–48 hrs with minimal documents.",Best Personal Loan in Aurangabad,942,published,1.0
Personal Loan,Maharashtra,Kolhapur,personal-loan/maharashtra/kolhapur,"Personal Loan in Kolhapur – Low Interest for Agri & Education | Techstar","Need funds in Kolhapur? Get Personal Loan at competitive rates. SBI, ICICI & Federal Bank options. Education & agri professionals eligible. Apply in 5 minutes.",Best Personal Loan in Kolhapur,940,published,0.9
Personal Loan,Maharashtra,Solapur,personal-loan/maharashtra/solapur,"Personal Loan in Solapur – Fast Finance for Textile Professionals | Techstar","Solapur textile workers & salaried employees – get Personal Loan at 10.50% p.a. Fast approval, flexible EMI. Compare Canara Bank, Union Bank & Axis. Apply now.",Best Personal Loan in Solapur,940,published,0.8
Personal Loan,Maharashtra,Amravati,personal-loan/maharashtra/amravati,"Personal Loan in Amravati – Quick Funds for Trade & Agriculture | Techstar","Apply for Personal Loan in Amravati and get funds in 24 hrs. Traders & salaried professionals preferred. Bank of Baroda, SBI & Yes Bank. Lowest EMI guarantee.",Best Personal Loan in Amravati,940,published,0.8
Home Loan,Maharashtra,Pune,home-loan/maharashtra/pune,"Home Loan in Pune – 8.40% Rate | PMAY Subsidy | Techstar Money Solution","Buy your dream home in Pune at 8.40% p.a. Save up to Rs.3.5L in tax. Compare SBI, HDFC, Kotak & 50+ lenders. Doorstep service in Kothrud, Baner & Wakad.",Best Home Loan in Pune,960,published,2.5
Home Loan,Maharashtra,Mumbai,home-loan/maharashtra/mumbai,"Home Loan in Mumbai – Compare 50+ Banks | Zero Processing Fee* | Techstar","Plan your Mumbai home with Home Loan starting 8.40% p.a. PMAY subsidy available. Instant sanction letter. Compare top banks & NBFCs. Expert DSA guidance.",Best Home Loan in Mumbai,960,published,2.2
Home Loan,Maharashtra,Nagpur,home-loan/maharashtra/nagpur,"Home Loan in Nagpur – Low EMI & Tax Benefit Up to Rs.3.5L | Techstar","Nagpur homebuyers get Home Loan from 8.40% p.a. Flexible 30-year tenure. Manufacturing professionals eligible. Compare ICICI, Bank of Baroda & Union Bank.",Best Home Loan in Nagpur,960,published,1.7
Home Loan,Maharashtra,Nashik,home-loan/maharashtra/nashik,"Home Loan in Nashik – Lowest Rates for First-Time Buyers | Techstar","First-time homebuyer in Nashik? Get Home Loan at 8.40% p.a. with PMAY subsidy benefit. Compare Punjab National Bank, Axis & Yes Bank. Instant approval.",Best Home Loan in Nashik,960,published,1.5
Home Loan,Maharashtra,Thane,home-loan/maharashtra/thane,"Home Loan in Thane – Rates from 8.40% | Instant Sanction | Techstar","Get Home Loan in Thane for new or resale property. Rates from 8.40% p.a. Zero processing fee*. Compare HDFC, IDFC & Canara Bank. Expert support included.",Best Home Loan in Thane,960,published,1.4
Home Loan,Maharashtra,Aurangabad,home-loan/maharashtra/aurangabad,"Home Loan in Aurangabad – Affordable EMI for Industrial Buyers | Techstar","Aurangabad residents – get Home Loan at 8.40% p.a. PMAY eligible. Bank of Maharashtra, SBI & Kotak options. Documentation assistance & fast sanction.",Best Home Loan in Aurangabad,960,published,1.3
Business Loan,Maharashtra,Pune,business-loan/maharashtra/pune,"Business Loan in Pune – Collateral Free MSME Funding | Techstar","Grow your Pune business without pledging assets. Collateral-free Business Loan at 14% p.a. MSME & startup approved in 24 hrs. Mudra loan, working capital & more.",Best Business Loan in Pune,970,published,3.0
Business Loan,Maharashtra,Mumbai,business-loan/maharashtra/mumbai,"Business Loan in Mumbai – MSME & Startup Finance | Techstar Money Solution","Mumbai entrepreneurs get collateral-free Business Loan at 14% p.a. Financial services & manufacturing firms preferred. Fast disbursal, paperless. Apply in 5 mins.",Best Business Loan in Mumbai,970,published,2.8
Business Loan,Maharashtra,Nagpur,business-loan/maharashtra/nagpur,"Business Loan in Nagpur – Working Capital for Factories | Techstar","Nagpur manufacturers & logistics businesses – get MSME Business Loan at 14% p.a. No collateral needed. ICICI, Bank of Baroda & Union Bank options. Apply now.",Best Business Loan in Nagpur,970,published,2.5
Business Loan,Maharashtra,Nashik,business-loan/maharashtra/nashik,"Business Loan in Nashik – Agri & Wine Industry MSME Funding | Techstar","Nashik agri-entrepreneurs & food businesses get Business Loan at 14% p.a. Collateral-free, paperless. Punjab National Bank, Axis & Yes Bank. Approved fast.",Best Business Loan in Nashik,970,published,2.5
Business Loan,Maharashtra,Thane,business-loan/maharashtra/thane,"Business Loan in Thane – IT & Real Estate MSME Finance | Techstar","Thane IT firms & real estate businesses get collateral-free Business Loan at 14% p.a. Fast approval, flexible tenure. Compare HDFC, IDFC & Canara Bank.",Best Business Loan in Thane,970,published,2.4
Business Loan,Maharashtra,Aurangabad,business-loan/maharashtra/aurangabad,"Business Loan in Aurangabad – Industrial & Heritage Sector MSME | Techstar","Aurangabad industrial businesses & tourism firms get Business Loan at 14% p.a. Bank of Maharashtra, SBI & Kotak. No collateral, minimal docs, quick approval.",Best Business Loan in Aurangabad,970,published,2.2
Loan Against Property,Maharashtra,Pune,lap-loan/maharashtra/pune,"Loan Against Property in Pune – Up to Rs.15 Cr at 9.00% | Techstar","Unlock your Pune property value. LAP up to Rs.15 Crores at 9.00% p.a. Residential & commercial accepted. Multi-bank eligibility check, fast approval. Apply now.",Best LAP Loan in Pune,980,published,3.2
Loan Against Property,Maharashtra,Mumbai,lap-loan/maharashtra/mumbai,"Loan Against Property in Mumbai – High Value Mortgage Loan | Techstar","Mumbai property owners get LAP up to Rs.15 Cr at 9.00% p.a. Commercial & residential accepted. Compare SBI, Kotak & Standard Chartered. Expert DSA support.",Best LAP Loan in Mumbai,980,published,3.0
Loan Against Property,Maharashtra,Nagpur,lap-loan/maharashtra/nagpur,"Loan Against Property in Nagpur – Lowest Mortgage Rate | Techstar","Nagpur residential & commercial property owners get LAP at 9.00% p.a. High LTV ratio. Compare ICICI, Bank of Baroda & Union Bank. Fast multi-bank approval.",Best LAP Loan in Nagpur,980,published,2.8
Loan Against Property,Maharashtra,Nashik,lap-loan/maharashtra/nashik,"Loan Against Property in Nashik – Agri Property Mortgage | Techstar","Nashik property & agri-land owners – get LAP at 9.00% p.a. Up to Rs.15 Crores. Punjab National Bank, Axis & Yes Bank. Minimal docs, doorstep service.",Best LAP Loan in Nashik,980,published,2.7
Loan Against Property,Maharashtra,Thane,lap-loan/maharashtra/thane,"Loan Against Property in Thane – Residential & Commercial | Techstar","Thane property owners unlock high-value funding with LAP at 9.00% p.a. Residential, commercial & plot accepted. Compare HDFC, IDFC & Canara Bank. Apply today.",Best LAP Loan in Thane,980,published,2.5
